{
  "id": "implicit-v1",
  "row": { "min": 0, "max": 0, "step": 1 },
  "col": { "min": 0, "max": 1, "step": 1 },
  "parameters": {
    "observation": { "stateProjection": [[1, 0], [0, 1]], "covariance": [[1, 0], [0, 1]], "dimension": 2 },
    "dynamic": { "transition": [[1, 0], [0, 1]], "covariance": [0.0000001, 0.0000001] }
  },
  "table": [[{ "state": { "mean": [[0.2], [-0.1]], "covariance": [[0.01, 0], [0, 0.01]], "index": 2 } }, { "state": null }]],
  "displayAttributes": { "label": "implicit-v1" }
}
